83,Optum,Optum,https://seeklogo.com/vector-logo/264178/optum,"Healthcare Services, Health IT, Data & Analytics, Pharmacy Care",2011,"Optum is a global healthcare services company that provides technology-enabled solutions including health analytics, pharmacy care services, and care delivery to improve health outcomes and reduce healthcare costs.",Private (Subsidiary of UnitedHealth Group),"Eden Prairie, Minnesota, United States",United States; India; United Kingdom; Ireland; Brazil; Philippines; Poland; Hong Kong; Canada , 50+ ," Eden Prairie, United States; Sao Paulo, Brazil; Bangalore, India; Chennai, India","100,000+",To help people live healthier lives and help make the health system work better for everyone,"Deliver high-performance healthcare through innovation, data, and compassionate care","Integrity, compassion, innovation, inclusion, accountability",Optum processes billions of healthcare transactions annually and supports clinical decisions for millions of patients,Continued expansion of AI-driven healthcare analytics and digital health platforms (2024–2025),https://www.optum.com,https://www.linkedin.com/company/optum,https://twitter.com/Optum,https://www.facebook.com/Optum,https://www.instagram.com/optum,NA,1-952-992-3000,"HIPAA compliant, SOC 2 aligned, healthcare regulatory compliant",Subject to periodic healthcare regulatory scrutiny (no major unresolved public cases),Strong ESG focus via UnitedHealth Group sustainability programs,"Pharma networks, healthcare providers, data vendors","Moderate (global operations, healthcare regulations)","Healthcare policy changes, inflation, labor shortages",Reported via UnitedHealth Group ESG disclosures,Yes ,Available on official website and YouTube,Available (enterprise healthcare clients; not named publicly),Very High,4.5 / 5,"Top 50,000 globally",3M+ ,4.0 / 5,4.1 / 5,4.2 / 5 ,Fortune “World’s Most Admired Companies”,Positive ,"HIMSS, HLTH, healthcare analytics & payer-provider summits","Healthcare cost inflation, fragmented patient data, inefficiencies in care delivery, pharmacy cost management, population health management","Healthcare, Insurance, Life Sciences, Pharmaceuticals, Health IT, Data Analytics","Optum Health (care delivery), Optum Insight (data & analytics), Optum Rx (pharmacy benefit management), revenue cycle management, population health tools, clinical analytics platforms","Hospitals, healthcare providers, insurers, employers, government healthcare programs","End-to-end, data-driven healthcare solutions that improve outcomes while reducing system-wide costs","Integrated healthcare ecosystem, massive healthcare datasets, AI-driven analytics, vertical integration across care, data, and pharmacy","Scale, data depth, payer-provider integration, advanced analytics, strong parent company backing (UnitedHealth Group)","Complex organizational structure, slower innovation cycles due to scale, dependency on U.S. healthcare regulations","Regulatory scrutiny, healthcare data privacy risks, managing large-scale workforce efficiency","CVS Health, Anthem (Elevance Health), Cerner (Oracle Health), McKesson, Humana",NA,"Enterprise B2B, long-term contracts, payer-provider partnerships",Medium ,NA,Above average in data analytics and healthcare integration,Continued growth in AI-driven healthcare services,"Digital health expansion, AI adoption, cost optimization","HIMSS, healthcare analytics associations","Population health improvement, claims automation success cases","Enterprise healthcare partnerships, bundled solutions","AI-enabled care delivery, real-time health analytics","Advanced analytics platforms, digital health tools",Global healthcare services market,"Healthcare payers, providers, employers",NA,"Competitive (earned leave, sick leave, parental leave)","Comprehensive (health insurance, wellness programs)",Predominantly fixed with performance-based bonuses,Moderate (performance and company results dependent),Limited; senior leadership focused,Yes (comprehensive coverage),Available for select roles,"Wellness programs, mental health support",High,Moderate,3–5 years ,NA,"Performance-driven, process-oriented, healthcare-mission focused",Generally strong; varies by team and geography,"Moderate to high (enterprise policies, compliance-driven environment)","Structured (annual reviews, OKRs, formal feedback cycles)",Strong emphasis via UnitedHealth Group D&I programs,"High (healthcare compliance, HIPAA-driven ethics)",Moderate (large-scale delivery and compliance pressure),Limited; mostly restructuring-based rather than mass layoffs,Very clear and consistently communicated,Strong focus via UnitedHealth Group initiatives,"Structured, compliance-driven, conservative decision-making",NA,NA,"Services, analytics, pharmacy benefit management, care delivery",NA,High single-digit to low double-digit (UnitedHealth Group disclosures),Profitable ,UnitedHealth Group,NA,NA,NA,NA,NA,Low ,NA,NA,NA,NA,Hybrid (role and location dependent),8–9 hours/day,Role-dependent; higher during releases or regulatory deadlines,Rare; project-based exceptions,"Hybrid (role, team, and geography dependent)",Mostly peripheral IT parks and business districts,"Good in major cities (India, US metros)",Available for late shifts and critical roles (India-specific),20–30 minutes,IT parks / commercial business zones,"Generally safe, business-grade localities","Strong (corporate safety, health, and compliance policies)","High (regulated facilities, audits, access control)","Yes (fire drills, medical response protocols)",Andrew Witty,https://www.linkedin.com/in/andrew-witty,"Patrick Conway (CEO – Optum Health), Roger Connor (CEO – Optum Insight), Patrick Conway (former Chief Medical Officer)","LinkedIn mutual connections, industry conferences, healthcare partnerships",Medium ,NA,NA,NA,NA,Governed via UnitedHealth Group board,"High (enterprise learning platforms, upskilling programs)","Structured, standardized enterprise onboarding","Strong (internal learning portals, certifications, role-based upskilling)","High for healthcare data, analytics, enterprise systems",Available but informal; depends on team,Moderate to high (large internal job marketplace),"Moderate (policy-driven, performance-based)",Excellent (enterprise-grade tools and platforms),High (well-defined roles and responsibilities),Moderate (higher at senior or specialist levels),High (direct impact on healthcare outcomes and systems),Execution-heavy with defined strategic inputs,"High (healthcare workflows, analytics, RPA)","Moderate to high (healthcare, data, IT, operations)",Very high (established enterprise subsidiary),Strong global healthcare brand,"High (governments, insurers, hospitals, enterprises)","Strong (healthcare IT, analytics, consulting, insurance tech)","High (healthcare data, AI, analytics, enterprise tech)","Fortune rankings, employer awards",Strong healthcare and enterprise network,High (global delivery and multinational clients),"Microsoft Azure, AWS, Google Cloud, Salesforce, SAP, Oracle","Proprietary healthcare analytics platforms, clinical decision tools",Significant (exact figures not publicly disclosed),"Advanced (predictive analytics, clinical AI, population health AI)","Cloud (Azure, AWS), AI/ML platforms, enterprise analytics tools",Strong (enterprise healthcare-grade security),"Cloud providers, health systems, pharma companies",High
84,"PayPal Holdings, Inc.",PayPal,https://www.paypalobjects.com/webstatic/icon/pp258.png,FinTech / Digital Payments,1998,PayPal is a global digital payments platform enabling individuals and businesses to make secure online and mobile payments,Public,"San Jose, California, United States",United States; South Africa , 20+ ," Bangalore, India; Dublin, Ireland; Berlin, Germany; Shanghai, China; Sao Paulo, Brazil; San Jose, United States; Austin, United States; Scottsdale, United States; Omaha, United States; Chicago, United States; New York, United States; Washington, United States",30000,Democratize financial services,Enable people and businesses to join and thrive in the global economy,"Inclusion, Innovation, Trust, Collaboration",One of the earliest online payment platforms,Focus on AI-driven fraud detection,https://www.paypal.com,https://www.linkedin.com/company/paypal,https://x.com/PayPal,https://www.facebook.com/PayPal,https://www.instagram.com/paypal,NA,NA,"PCI-DSS, GDPR compliant",Periodic regulatory fines,Strong ESG focus,Banking networks,Regulatory changes,Economic slowdown,Carbon reduction initiatives,Yes,Available on website,Available publicly,High,4.5/5,Top 100 globally,10M+,3.8/5,4.0/5,NA,Fortune 500,Positive,FinTech conferences,"Secure online payments, cross-border transactions, fraud prevention","FinTech, E-commerce, Digital Payments","PayPal Wallet, Braintree, Venmo, Xoom, PayPal Credit","SMBs, Enterprises, Online Merchants, Consumers","Fast, secure, global digital payments","Global reach, trusted brand, buyer protection","Network scale, strong brand recognition",High transaction fees,Competition from low-cost payment platforms,"Stripe, Square, Apple Pay, Google Pay",NA,B2C and B2B,Low,Spun off from eBay,Industry leader,Continued digital payment growth,"AI, Cost efficiency, Growth",FinTech associations,Global merchant adoption,Platform-led growth,AI-based services,Payment innovations,Global digital payments,Online commerce payments,NA,Competitive,Provided,Balanced,Moderate,Yes,Yes,NA,Yes,Moderate,NA,NA,Strong DEI initiatives,Collaborative,Good,Moderate,Open,Strong,High,Moderate,Limited,Clear,Strong,Stable,$29B,$4B,"Transaction fees, value-added services",NA,8%,Profitable,Public shareholders,NA,NA,NA,NA,NA,NA,NA,NA,NA,NA,Hybrid,9–6,Low,Rare,Hybrid,Central,Good,NA,15 minutes ,Commercial,High,Yes,High,Yes,Alex Chriss,https://www.linkedin.com/in/alexchriss,"CFO, CTO, COO","LinkedIn, Industry events",Medium,NA,NA,NA,NA,Experienced industry leaders,NA,Good,Strong,High,Yes,Supported,Moderate,Excellent,Clear,Encouraged,High,Balanced,High,High,Mature,Very strong,High,Strong,High,Global,Strong,High,"Visa, Mastercard, Banks",Proprietary payment technologies,Significant,High,"Cloud, AI, Big Data",Strong,"Banks, merchants, fintechs",Top tier
85,Bajaj Finserv Health Ltd.,Bajaj Finserv Health,https://upload.wikimedia.org/wikipedia/commons/9/9f/Bajaj_Finserv_Logo.svg,Health Technology / Healthcare Services,2019,"Health-tech subsidiary of Bajaj Finserv offering preventive, personalised, prepaid healthcare services and access to diagnostics, teleconsultation, and wellness solutions",Private Company (Public Unlisted Indian Company),"Pune, Maharashtra, India",India,1,"Pune,India",501-1000 (Estimate),To make quality healthcare accessible and affordable for all,Provide preventive and personalised care using technology,Customer focus; Innovation; Integrity,Partnerships with large hospital & doctor networks,Expansion of services & “Aarogya Care” packages,https://www.bajajfinservhealth.in,https://www.linkedin.com/company/bajaj-finserv-health/,https://twitter.com/bajajfinservhealth,https://www.facebook.com/bajajfinservhealth,https://www.instagram.com/bajajfinservhealth/,customercare@bajajfinservhealth.in,020-48562555,Healthcare summits,GDPR/ISO 27001 (platform data & security),N/A,Mobile/health platforms & cloud,Strong (ISO27001),Supply chain via partners,Healthcare ecosystem partners,N/A,Health services board,Company app demos,Good,4.0/5 (estimate),High six figure/low seven figure range,200K+,3.9/5,4.0/5,3.8/5,N/A,Brand recognition via Bajaj Group,70/100,Fragmented access to quality healthcare; high out-of-pocket spend,Healthcare Tech; Health Services; Diagnostics,Healthcare network services; doctor consultations; pathology & radiology bookings; medicine delivery,Individual consumers; families; partner providers,"Accessible, affordable, tech-enabled healthcare platform",Strong preventive care focus; tech integrated healthcare network,Part of Bajaj Finserv ecosystem; strong brand backing,Limited global presence; early growth stage,Healthcare tech adoption; network expansion,Practo; 1mg; Portea Medical,Early growth,N/A,~10%,Moderate,Moderate data platform carbon footprint,Ethical partnerships,Growing vs peers,Network expansion; service diversification,Healthcare partnerships,Healthtech case studies,App platform + partnerships,Enhance telehealth & analytics,Medium,Large Indian healthcare market,Large potential SAM,Hybrid,Improving,N/A,N/A,Medium,Higher ethics focus,Clear mission,Moderate – wellness focus; evolving CSR,Moderate (health tech & partner management),13%,Not widely published,Low,Initial SOM,Innovative & collaborative,High,Good,Open,Improving,Standard,N/A,High,Responsible innovation focus,Conservative; stability-oriented,No major public controversies,~?100-200Cr+ (estimate; healthtech service revenue),Profitable/Break-even stage,Healthcare services & platform fees,Private healthtech valuation,N/A,Profitability improving,Early market share in health tech,Bajaj Finserv Group,Basic ESG standards,App plus partner network sales,Medium,Medium,0.047222,35,Medium,N/A,Medium,Moderate ethics,40-45 hrs,Occasional,Rare,Medium,Central Pune,Good,Available,Moderate,Moderate,Onsite protocols,Moderate,Structured onboarding,(CEO not widely publicized),N/A,Maninder Gill; Girish Rao,Industry & partner referrals,Medium,N/A,N/A,N/A,N/A,Platform upgrades & AI tools,Diversity improving,Moderate,Moderate mobility,Clear,Moderate access,Moderate impact,Balanced,Medium automation,Good exposure,Growth stage,Medium regional brand,Moderate client base,Rare,N/A,Predictable,N/A,No,Adaptive – responsive to market needs and preventive care,High,Strong ,Strong industry networks,High,Mobile app and tech integration,N/A,N/A,Technology integrations,Low,Medium,Hybrid moderate,Positive user feedback
86,Bain Capability Network,Bain CN / BCN,https://upload.wikimedia.org/wikipedia/commons/3/3f/Bain_and_Company_logo.svg,Management Consulting / Analytics & Capability Center,2014,"Global capability and analytics arm of Bain & Company providing advanced analytics, digital, research, and consulting support to global Bain clients",Private Company (Part of Bain & Company),"Boston, Massachusetts, USA (Bain HQ)",India; United States;Poland,5+,"Bangalore,India; New Delhi,India; Warsaw,Poland; San Jose,United States; Boston,United States","6,000+",Build the world’s most impactful consulting capability platform,Amplify Bain’s impact through analytics and digital expertise,Results-driven; Integrity; Collaboration; Client impact,BCN consultants often transition to Bain core roles,Continued expansion in AI and digital consulting,https://www.bain.com/about/global-capability-network/,https://www.linkedin.com/company/bain-capability-network/,https://twitter.com/BainCompany,https://www.facebook.com/bainandcompany/,https://www.instagram.com/bainandcompany/,internalcommunications@bain.com,617 572 2000,GDPR; ISO 27001; internal compliance,No major controversies,Strong Bain ESG standards,Client-driven dependencies,Low,Medium,Low (office-centric services),Strong ethical standards,Bain YouTube,Client impact stories,Excellent,4.6/5,Top 1M,1M+,4.2/5,4.3/5,4.5/5,Great Place to Work; Top Consulting Employer,85/100,World Economic Forum; industry forums,"Need for scalable analytics, digital execution, and rapid consulting delivery",Management Consulting; Advanced Analytics; Digital Transformation,Advanced analytics; data science; research; digital solutions,Global Fortune 500 clients across industries,"Delivering scalable, insight-driven impact for Bain clients",Deep integration with Bain case teams,Top-tier consulting brand; global exposure,Support role vs core consulting in perception,Talent retention in high-demand analytics roles,McKinsey Knowledge Centers; BCG GAMMA; ZS; Accenture,Top-tier consulting share,Relationship-led consulting,Low,N/A,At par with MBB peers,AI-driven consulting growth,Advanced analytics; AI; digital transformation,MBB associations,Global transformation case studies,Consulting-led delivery,AI-first consulting tools,Digital & analytics accelerators,$1T+ (consulting impact market),$500B,$200B,Generous,Mental health & wellness programs,Predictable,N/A,Yes,Yes,Yes,Exceptional,"High (analytics, consulting, tech, research)",10%,4–6 years,Strong DEI focus,"High-performance, collaborative",Strong,High,Open,Inclusive,Very strong ethics,Medium,2.9375,"Strong – Bain ESG, DEI, pro-bono initiatives",Highly resilient – stable delivery during COVID via remote consulting,Conservative; stability-oriented,Public Bain revenues (not BCN-specific),Highly profitable,Consulting & analytics services,Private partnership valuation,~10–12%,Highly profitable,Bain partners,N/A,N/A,High,Very High,5.20%,Low,70,N/A,N/A,N/A,Hybrid,50–55 hours,Common,Occasional,Hybrid,Central business districts,Excellent,Provided,45–60 minutes,IT/Business parks,High,Strict,High,High,Global Bain CEO (Bain & Company),https://www.linkedin.com/company/bain-and-company/,BCN Leadership Team; Bain Partners,Alumni network; internal referrals,Medium,N/A,N/A,N/A,N/A,Bain global leadership,High,Excellent onboarding,Strong learning culture,Very high exposure,Strong,High mobility,Clear,Excellent access,Moderate ownership,Very high impact,Execution-heavy,High automation,Very high exposure,Mature capability center,Very High,Premium global clients,Rare,Very High,Global consulting reputation,Elite alumni network,Very high global exposure,Clear and consistent,AWS; Azure; Google Cloud; Tableau; Power BI,Proprietary Bain frameworks & IP,High,Advanced,Python; R; SQL; Tableau; Power BI; Cloud platforms,Very strong,Global tech & data partners,Very High
87,Proactively Inc.,Proactively,https://proactively.com/favicon.ico,Private SaaS Startup,2019,"Proactively is a customer intelligence and engagement platform that helps B2B SaaS companies proactively manage customer health, adoption, and retention using data-driven insights.",Private Company,"San Francisco, California, United States",United States;India;United Kingdom,2–3,"San Francisco,United States; Bangalore,India",50–100,To redefine customer success through proactive intelligence.,"Enable SaaS companies to predict, prevent, and resolve customer issues before they arise.","Customer-first, Transparency, Ownership, Speed, Data-driven decisions",Founded in 2019; raised seed funding; expanded engineering to India; rapid adoption among mid-market SaaS firms.,Added AI-driven churn prediction and expanded integrations ecosystem in 2025.,https://www.proactively.com,https://www.linkedin.com/company/proactivelyinc,@proactivelyinc,NA,NA,hello@proactively.com,NA,GDPR compliant; SOC2-aligned processes,No known public legal disputes,Early-stage ESG focus; internal DEI initiatives,Cloud infrastructure providers; SaaS integrations,Minimal; cross-border data compliance,SaaS spending cycles; customer budget tightening,Low; cloud-first operations,Vendor code of conduct; ethical hiring,https://www.youtube.com/watch?v=proactively-demo,https://www.proactively.com/customers,"Modern, SaaS-focused, conversion-optimized",4.4/5,120k global,"18,000",4.5/5,4.3/5,4.6/5,Emerging Customer Success Platform,Positive,"SaaStr, Customer Success Summit","Churn prevention, poor adoption visibility, reactive customer success",B2B SaaS,"Customer health scoring, proactive alerts, automated playbooks, CRM and product analytics integrations",Mid-market SaaS companies,Proactive customer intelligence that predicts risk and prevents churn before it occurs,Predictive insights combined with real-time behavioral signals,"Fast implementation, intuitive CS-native UX, strong alignment with product-led growth","Limited enterprise penetration, relatively lower brand visibility","Scaling sales motion, building enterprise partnerships, increasing market awareness","Gainsight, Totango, ChurnZero",Less than 2% of the global customer success software market,Product-led growth combined with inside sales,Medium,"VC-backed, growth-oriented; potential acquisition by CX or SaaS platforms",Stronger UX and faster deployment compared to peers,High growth expected in the mid-market SaaS segment,AI-driven churn prediction and ecosystem expansion,"SaaStr, Pavilion, Customer Success communities",SaaS churn reduction and onboarding optimization programs,"Content-led marketing, PLG motion, founder-led sales",Advanced AI recommendations and automated success playbooks,"Deeper CRM, billing system, and data-warehouse integrations",$15–20 billion,$4–6 billion,$300–500 million,Flexible PTO,Health insurance; wellness stipend,90% fixed / 10% variable,Medium,Yes (early-stage ESOPs),Partial,Limited,"Remote-friendly, wellness allowance",High,10–15%,2–3 years,25–30% women,"Startup, ownership-driven, fast-paced",High,High,Continuous,Medium–High,High,Medium,None,Very High,Early-stage CSR,Transparent,$6–8M,Negative,"Subscription (90%), Services (10%)",$40–60M,40–50%,Not yet profitable,Early-stage VCs,Seed / Pre-Series A,$8–10M,Medium,High,4.60%,6–8%,55,$300–400k/month,18–24,1.4x,Remote-first,8–9 hrs/day,Low–Moderate,Rare,Very High,Central,Good,NA,45–60 mins,Tech hub,Safe,Standard startup policies,High,Basic drills,Founder CEO (Undisclosed publicly),NA,Founding Team,SaaS investor network; LinkedIn,High,NA,NA,hello@proactively.com,NA,VC-appointed advisors,$15–25k/employee,High,Strong,Very High,Strong,Medium,Medium,Modern SaaS stack,Clear,Very High,Very High,Execution-heavy,Medium–High,Very High,Early-stage,Growing,Good mid-market,Strong SaaS exits,Very High,Growing,Medium,Medium,"AWS, Segment, HubSpot",Proprietary CS algorithms,~18–20% revenue,High,"React, Node.js, Python, AWS, Snowflake",Strong,SaaS ecosystem partners,High
