company_id,name,short_name,logo_url,category,incorporation_year,overview_text,nature_of_company,headquarters_address,operating_countries,office_count,office_locations,employee_size,vision_statement,mission_statement,core_values,history_timeline,recent_news,website_url,linkedin_url,twitter_handle,facebook_url,instagram_url,primary_contact_email,primary_phone_number,regulatory_status,legal_issues,esg_ratings,supply_chain_dependencies,geopolitical_risks,macro_risks,carbon_footprint,ethical_sourcing,marketing_video_url,customer_testimonials,website_quality,website_rating,website_traffic_rank,social_media_followers,glassdoor_rating,indeed_rating,google_rating,awards_recognitions,brand_sentiment_score,event_participation,pain_points_addressed,focus_sectors,offerings_description,top_customers,core_value_proposition,unique_differentiators,competitive_advantages,weaknesses_gaps,key_challenges_needs,key_competitors,market_share_percentage,sales_motion,customer_concentration_risk,exit_strategy_history,benchmark_vs_peers,future_projections,strategic_priorities,industry_associations,case_studies,go_to_market_strategy,innovation_roadmap,product_pipeline,tam,sam,som,leave_policy,health_support,fixed_vs_variable_pay,bonus_predictability,esops_incentives,family_health_insurance,relocation_support,lifestyle_benefits,hiring_velocity,employee_turnover,avg_retention_tenure,diversity_metrics,work_culture_summary,manager_quality,psychological_safety,feedback_culture,diversity_inclusion_score,ethical_standards,burnout_risk,layoff_history,mission_clarity,sustainability_csr,crisis_behavior,annual_revenue,annual_profit,revenue_mix,valuation,yoy_growth_rate,profitability_status,key_investors,recent_funding_rounds,total_capital_raised,customer_acquisition_cost,customer_lifetime_value,cac_ltv_ratio,churn_rate,net_promoter_score,burn_rate,runway_months,burn_multiplier,remote_policy_details,typical_hours,overtime_expectations,weekend_work,flexibility_level,location_centrality,public_transport_access,cab_policy,airport_commute_time,office_zone_type,area_safety,safety_policies,infrastructure_safety,emergency_preparedness,ceo_name,ceo_linkedin_url,key_leaders,warm_intro_pathways,decision_maker_access,contact_person_name,contact_person_title,contact_person_email,contact_person_phone,board_members,training_spend,onboarding_quality,learning_culture,exposure_quality,mentorship_availability,internal_mobility,promotion_clarity,tools_access,role_clarity,early_ownership,work_impact,execution_thinking_balance,automation_level,cross_functional_exposure,company_maturity,brand_value,client_quality,exit_opportunities,skill_relevance,external_recognition,network_strength,global_exposure,technology_partners,intellectual_property,r_and_d_investment,ai_ml_adoption_level,tech_stack,cybersecurity_posture,partnership_ecosystem,tech_adoption_rating
1,Accenture plc,Accenture,https://www.accenture.com/_acnmedia/Accenture/Dev/RedesigNAcc_Logo_Black.svg,Enterprise,1989,"Accenture is a global professional services company providing strategy, consulting, digital, technology, and operations services, serving large enterprises and governments across more than 120 countries with a strong focus on cloud, AI, and digital transformation.",Public,"Dublin, Ireland",United States; United Kingdom; India; Germany; France; Japan; Australia; Canada; Brazil; Singapore,200+,"New York, United States; London, United Kingdom; Bangalore, India; Paris, France; Tokyo, Japan; Toronto, Canada; Sydney, Australia; Frankfurt, Germany","740,000 employees",To drive continuous innovation and help the world’s leading organizations build their digital core and achieve greater value.,"Deliver on the promise of technology and human ingenuity to create value and shared success for clients, people, shareholders, partners, and communities.",Client value creation; Integrity; Respect for individuals; Innovation; Stewardship; Best people,One of the largest employers of tech talent globally; Invests over $1B annually in R&D and innovation,"2024,Invested $3B in generative AI strategy; 2024,Acquired multiple cloud and AI consulting firms in Europe",https://www.accenture.com,https://www.linkedin.com/company/accenture,@Accenture,https://www.facebook.com/accenture,https://www.instagram.com/accenture,contact@accenture.com,NA,ISO 27001; SOC 2; GDPR Compliance; HIPAA Compliance,Periodic labor and contract disputes; no major unresolved global litigation,Net-zero commitment by 2025; Science Based Targets; Diversity equity programs,Cloud providers; Software vendors; Talent workforce,Trade regulations; Data privacy laws; Regional conflicts,Global recession; Enterprise IT budget cuts,Actively reducing via renewable energy sourcing,Supplier code of conduct; ESG audits,https://www.youtube.com/@Accenture,Unilever transformation story; Microsoft cloud case,"Enterprise-grade, high clarity, strong thought leadership, polished UX",NA,"Global 12,000; US 4,000 ",15000000,4.1/5,4.2/5,4.3/5,Fortune Global 500; Great Place to Work Certified; Gartner Magic Quadrant Leader; Forbes Most Admired Companies,"Very Positive,strong global brand, high enterprise trust",World Economic Forum; Microsoft Ignite; AWS re:Invent; Global Fintech Fest,Digital transformation complexity; Legacy IT modernization; Cloud migration risk; Talent and skill gaps; Cybersecurity threats; Operational inefficiency,Financials; Health Care; Consumer Discretionary; Industrials; Energy; Telecommunications; Public Sector; Technology,Management Consulting; Technology Services; Cloud Solutions; AI & Analytics; Cybersecurity; Business Process Outsourcing; Digital Engineering,Fortune 500 Enterprises; Global Banks; Government Agencies; Healthcare Systems; Telecom Operators; Energy Majors,End-to-end transformation; Global delivery scale; Deep industry expertise; Strong technology partnerships; Innovation leadership,Global delivery network; Industry-specific consulting; Strong alliance ecosystem; Proprietary AI and analytics platforms,Brand leadership; Scale and geographic reach; Deep enterprise relationships; Strong partner network,High cost structure; Dependency on large enterprise spending cycles; Complex organizational structure,Talent retention; Pricing pressure from competitors; Rapid AI disruption; Regulatory compliance across regions,IBM Consulting; Deloitte; TCS; Infosys; Capgemini; Cognizant; Wipro; PwC; EY,6–7% of global IT services market,Enterprise Field Sales,"No,highly diversified client base",Mature public enterprise; Strategic acquisitions,Higher revenue than Capgemini; Comparable margins to IBM Consulting; Stronger cloud alliances than TCS,Revenue projected $70B by 2027,Generative AI leadership; Cloud transformation; Sustainability consulting; Emerging markets growth,World Economic Forum; NASSCOM; Business Roundtable,Microsoft cloud modernization; Unilever digital supply chain,Enterprise account teams; Strategic alliances; Thought leadership marketing,GenAI platforms; Industry cloud solutions; Cyber resilience tools,AI copilots; Industry SaaS accelerators,$1.5T global IT and business services,$400B enterprise digital transformation,7%,Paid leave; Mental health days,Health insurance; Mental wellness,Mostly fixed,Moderate,Stock grants; Performance shares,Dependents covered; OPD,Housing; Travel reimbursement,Wellness programs; Meals; Fitness,"Technology ~15,000 open roles; Consulting ~8,000 open roles; Operations ~6,000 open roles; Sales ~2,000 open roles",15% annually (industry benchmark estimate),4.5 years,47% women workforce; Global DEI programs,Collaborative; Performance-driven,Strong coaching focus,High,Continuous feedback; Annual reviews,Gender equity; Inclusive leadership,High integrity; Compliance-driven,Moderate,Periodic restructuring,High,Net-zero goals; Community programs,Transparent and compliance-driven,$64.1B (FY2024),$7.2B net income (FY2024),Consulting 55%;ManagedServices 45%,$220B market capitalization ,3%,Profitable,Vanguard Group; BlackRock; State Street,"Public equity markets,ongoing institutional investment",Public market funded,$100K+ per enterprise ,$5M+,NA,<3%,60,"Not Applicable,cash-flow positive",Not Applicable,<1.0,"Hybrid, 60% flexible",Flexible,Occasional during project peaks,Rare,Remote; Hybrid,Central business districts,Metro; Bus; Train,Ride-hailing; Company transport,45 minutes,IT hub,Secure; Well-monitored,Late-night transport; Workplace safety,Fire compliant; Secure access,Medical support; Fire drills,Julie Sweet,https://www.linkedin.com/in/juliesweet,"Julie Sweet,Chair & CEO;Manish Sharma,CEO; Jack Azagury,Group Chief Executive",Fortune 500 board connections; Alumni network; Technology partner ecosystems,"Low,Large enterprise structure with formal procurement and partner-led access",Julie Sweet,CEO,prabhakar.d.phatak@accenture.com,793 1578,Julie Sweet; David Rowland; Former global executives,"$1,500 per employee/year",Industry-leading,Internal LMS; Certifications,High,Leadership mentors; Peer mentors,High,Merit-based; Transparent,Enterprise software; Cloud platforms,High,Medium,Client-facing; Revenue-linked,Balanced,High,Consulting; Technology; Sales,Mature enterprise,Global top-tier brand,Fortune 500; Governments,Big Tech; Global consultancies; Industry leadership roles,Very High,Strong global credibility,Global alumni network; Executive connections,Global clients; International teams,Microsoft; SAP; Oracle; AWS; Google Cloud; Salesforce; NVIDIA,Accenture Labs IP; Industry AI frameworks; Proprietary cloud accelerators,$1.5B annually,"High,generative AI platforms, AI-led consulting, automation for delivery optimization",SAP; Salesforce; AWS; Microsoft Azure; ServiceNow; Kubernetes; Python,ISO 27001; SOC 2; Global cyber defense centers,Microsoft; SAP; Oracle; Google; AWS; Salesforce,"High,Industry Leader; Top-tier among peers"
2,Fractal Analytics Private Limited,Fractal,https://fractal.ai/wp-content/uploads/2022/05/fractal-logo.svg,Enterprise,2000,"Fractal is a global AI and advanced analytics company that helps Fortune 500 and large enterprises leverage data, machine learning, and digital solutions to drive business transformation, customer engagement, and operational efficiency.",Private,"Mumbai, Maharashtra, India",India; United States; United Kingdom; Hong Kong; Australia; Canada,10+,"Mumbai, India; Bangalore, India; New York, United States; San Francisco, United States; London, United Kingdom; Sydney, Australia; Toronto, Canada","4,000 employees",To power every human decision in the enterprise through AI and analytics.,"Help the world’s most admired companies use AI and data to drive ethical, sustainable, and scalable business growth.",Client success; Innovation; Integrity; Collaboration; Continuous learning,One of India’s earliest AI-first companies; Majority investment by TPG in 2022,"2023,Launched healthcare AI platform for pharma analytics; 2024,Expanded partnerships with global cloud providers",https://fractal.ai,https://www.linkedin.com/company/fractal-analytics,@fractalai,https://www.facebook.com/FractalAI,https://www.instagram.com/fractal.ai,info@fractal.ai,NA,ISO 27001; GDPR Compliance; SOC 2,No major public legal controversies reported,Diversity hiring initiatives; Digital-first delivery; Sustainability reporting,Cloud providers; Data vendors; Talent workforce,Data localization laws; Cross-border data transfer regulations,Enterprise IT budget tightening; Global economic slowdown,"Low to moderate,primarily digital and cloud-based operations",Vendor code of conduct; ESG screening,https://www.youtube.com/@FractalAI,Global CPG analytics success story; Fortune 100 bank AI transformation,"Modern, enterprise-focused, strong AI thought leadership, clear industry positioning",8.5/10,Global 150K; US 60K,350000,4.0/5,4.1/5,4.3/5,Great Place to Work Certified; Forbes AI 50 Asia; Analytics India Awards,"Positive,strong enterprise trust and AI expertise perception",World AI Summit; AWS re:Invent; Gartner Data & Analytics Summit,Low ROI from data initiatives; Lack of AI talent; Siloed data systems; Poor customer personalization; Slow decision-making; Model deployment complexity,Financials; Consumer Discretionary; Health Care; Industrials; Information Technology; Retail,AI and Analytics Consulting; Data Engineering Services; Machine Learning Platforms; CPG and Retail AI Solutions; Healthcare Analytics; Marketing Analytics,Fortune 500 CPG Companies; Global Banks; Retail Chains; Pharmaceutical Companies; Insurance Providers; Technology Enterprises,End-to-end AI lifecycle delivery; Deep domain expertise; Scalable global delivery model; Proprietary AI platforms; Strong ROI focus,Strong CPG and healthcare analytics depth; Proprietary AI platforms; Global delivery with local consulting presence; High client retention,Deep domain models; Long-term enterprise relationships; Scalable AI talent pool; Strong global partnerships,Lower global brand visibility than Big Four; Heavy dependence on large enterprise clients; Limited productized SaaS offerings,Scaling AI governance; Competing with global consultancies; Talent retention in AI roles; Expanding SaaS portfolio,Accenture Applied Intelligence; Deloitte Analytics; TCS Analytics; Infosys AI; Mu Sigma; ZS Associates; Genpact; Cognizant,3–4% of global enterprise AI services,Enterprise Field Sales,"Yes,Top 10 clients ~35% revenue",Potential IPO; Strategic acquisition opportunities,Stronger AI depth than Genpact; Comparable analytics scale to Mu Sigma; Higher healthcare focus than TCS Analytics,Revenue projected $500M by 2027,Global expansion; SaaS AI platforms; Healthcare analytics growth; GenAI solutions,NASSCOM; Analytics India Magazine; World Economic Forum AI groups,Fortune 50 CPG demand forecasting; Global bank AI-driven risk analytics,Enterprise account teams; Industry-focused consulting; Cloud partner co-selling,Generative AI platforms; Vertical SaaS analytics; MLOps automation,AI copilots; Healthcare analytics suite; Marketing optimization tools,$300B global enterprise AI and analytics services,$80B enterprise AI services,4%,Paid leave; Mental health days; Annual PTO,Health insurance; Mental wellness; OPD,Mostly fixed,Moderate,Employee stock options; Performance bonuses,Dependents covered; OPD,Housing; Travel reimbursement,Wellness programs; Meals; Fitness,Data Science ~120 open roles; Engineering ~80 open roles; Consulting ~60 open roles; Sales/BD ~25 open roles,14% annually,4 years,35% women workforce; Global DEI programs,Collaborative; Performance-driven,Strong coaching focus,High,Continuous feedback; Quarterly reviews,Gender equity programs; Inclusive leadership,High integrity; Compliance-driven,Moderate,No major layoffs reported,High,Digital inclusion; ESG initiatives,Transparent and compliance-driven,$300–350M ,$26M,Consulting&Services 80%;Platforms&IP 20%,$1.5B (estimated post-TPG investment),20%,Profitable,TPG Capital; Khaitan Holdings,"Growth Equity,$360M,2022,TPG Capital",$400M,$50K per enterprise ,~$1M+,83.40%,<5%,55,~$4M/month ,36 months,~1.2x,"Hybrid, 50% flexible",Flexible,Occasional during project peaks,Rare,Remote; Hybrid,Central business districts,Metro; Bus,Ride-hailing; Company transport,45 minutes,IT hub,Secure; Well-lit,Late-night transport; Workplace safety,Fire compliant; Secure access,Medical support; Fire drills,Srikanth Velamakanni,https://www.linkedin.com/in/srikanthvelamakanni,"Srikanth Velamakanni,Co-founder & CEO; Pranay Agrawal,Co-founder & CEO; Shashank Dubey,Global Head Marketing",TPG Capital network; Fortune 500 client executives; Global AI leadership forums,"Medium,enterprise sales model with leadership access via partnerships and senior BD teams",Pranay Agrawal,CEO,somya.agarwal@fractal.ai.,(022) 40675800,Srikanth Velamakanni; TPG Partner Representatives; Independent Directors,"$1,200 per employee/year",Strong,Internal LMS; Certifications; AI bootcamps,High,Leadership mentors; Peer mentors,Medium,Merit-based; Transparent,Cloud platforms; AI frameworks; DevOps tools,High,High,Client-facing; Revenue-linked,Balanced,High,Consulting; Engineering; Sales,Scale-up,Strong in AI and analytics,Fortune 500; Global enterprises,Big Tech; Global consultancies; AI startups,Very High,Strong AI and analytics credibility,Strong alumni network; VC ecosystem,Global clients; International teams,AWS; Microsoft Azure; Google Cloud; Snowflake; Databricks,Proprietary AI platforms; Industry-specific ML models; Analytics accelerators,10% of revenue,"High,enterprise AI platforms, MLOps pipelines, automated decision systems",AWS; Azure; Google Cloud; Python; TensorFlow; Snowflake; Databricks,ISO 27001; SOC 2; Regular penetration testing,AWS; Microsoft; Google Cloud; Snowflake; Databricks,"High,AI Leader; Above average enterprise maturity"
3,Oracle India Private Limited,Oracle India,https://www.oracle.com/a/ocom/img/oracle-logo.svg,Enterprise,1993,"Oracle India Private Limited is the Indian subsidiary of Oracle Corporation, delivering enterprise cloud infrastructure, database technologies, SaaS applications, and IT consulting/services to large enterprises and government organizations across India and global markets.",Subsidiary,"Oracle Technology Park, S.No. 129/2/1, 129/2A/1, 129/2B/1 & 131/2/1 Devarabeesanahalli Village, Varthur Hobli, Sarjapur Road, Bangalore - 560103, Karnataka, India wikipedia?",India; United States; Ireland; Hong Kong; United Kingdom; Germany; Japan; Australia; Canada; United Arab Emirates,25+ wikipedia?,"Hyderabad, India; Chennai, India; Mumbai, India; Gurgaon, India; Noida, India; Pune, India; Kochi, India; Dublin, Ireland; Austin, United States",40000,"To help people see data in new ways, discover insights, and unlock endless possibilities.",Deliver innovative cloud and enterprise technologies that help organizations run their most critical workloads securely and efficiently.,Integrity; Innovation; Customer success; Collaboration; Inclusion,One of Oracle’s largest global development centers is in India; Major contributor to Oracle’s global cloud R&D,"2023,Announced new OCI cloud regions in India; 2024,Expanded partnerships with Indian public sector and telecom providers",https://www.oracle.com/in,https://www.linkedin.com/company/oracle,@Oracle,https://www.facebook.com/Oracle,https://www.instagram.com/oracle,india-info_ww@oracle.com,NA,ISO 27001; SOC 2; GDPR Compliance; PCI-DSS,Periodic licensing and contract disputes; no major unresolved public litigation in India,Renewable energy sourcing; Diversity and inclusion programs; Community education initiatives,Semiconductor vendors; Cloud hardware suppliers; Global software partners,Data localization laws; Trade regulations; Cross-border data transfer policies,Enterprise IT spending cycles; Global economic slowdown,Actively reducing through renewable data centers and efficiency programs,Supplier code of conduct; ESG audits,https://www.youtube.com/@Oracle,Indian public sector cloud success story; Global bank OCI migration,"Highly professional, enterprise-focused, strong product documentation and cloud service clarity",NA,"Global 1,500; US 600 ",10000000,3.9/5,4.1/5,4.2/5,Gartner Magic Quadrant Leader; Great Place to Work India; Top Employer Certification,"Very Positive,strong enterprise trust and technology leadership perception",Oracle CloudWorld; NASSCOM Tech Summit; India Mobile Congress,Legacy system modernization; Cloud migration complexity; Data security and compliance; Enterprise application integration; Scalability of IT infrastructure,Financials; Health Care; Public Sector; Energy; Industrials; Telecommunications; Technology,Oracle Cloud Infrastructure; Oracle Database; Fusion Cloud Applications; NetSuite ERP; Middleware Solutions; Consulting Services,Large Indian Enterprises; Global Banks; Government Agencies; Telecom Operators; IT Services Firms; Manufacturing Corporations,End-to-end enterprise technology stack; High-performance cloud infrastructure; Industry-grade security and compliance; Deep database leadership,Autonomous Database technology; Integrated cloud-to-application stack; Strong government and enterprise relationships; Global R&D presence in India,Database market leadership; Global cloud infrastructure footprint; Strong enterprise trust; Deep ecosystem partnerships,Smaller cloud market share versus hyperscalers; Perception of premium pricing; Complex licensing models,Competing with AWS/Azure/Google; Talent retention in cloud skills; Expanding OCI adoption in India; Regulatory data localization,AWS; Microsoft Azure; Google Cloud; SAP; IBM; Salesforce; TCS; Accenture,10–15% of Indian enterprise database and middleware market,Enterprise Field Sales,"No,diversified enterprise base",Mature subsidiary; Strategic expansions and acquisitions,Stronger database leadership than SAP; Comparable cloud performance to Azure in India; Smaller IaaS footprint than AWS,India revenue projected $4B by 2027,Expand OCI regions; Grow government cloud adoption; AI-driven database services; Partner ecosystem expansion,NASSCOM; Confederation of Indian Industry; Cloud Native Computing Foundation,Indian government cloud migration; Global bank core banking modernization,Enterprise account teams; Partner-led sales; Industry vertical solutions,Autonomous cloud services; AI-powered analytics; Industry SaaS solutions,GenAI cloud services; Industry cloud platforms; Advanced security tools,$1.5T global enterprise IT and cloud services,$120B Asia-Pacific enterprise cloud and software,8%,Paid leave; Mental health days; Annual PTO,Health insurance; Mental wellness; OPD,Mostly fixed,Moderate,Stock grants; Performance bonuses,Dependents covered; OPD,Housing; Travel reimbursement,Wellness programs; Meals; Fitness,"Cloud Engineering ~1,500 open roles; Consulting ~900 open roles; Sales ~400 open roles; Support ~600 open roles",14% annually ,4 years,35% women workforce; Global DEI initiatives,Collaborative; Performance-driven,Strong coaching focus,High,Continuous feedback; Annual reviews,Gender equity programs; Inclusive leadership,High integrity; Compliance-driven,Moderate,Periodic global restructuring,High,Education initiatives; Renewable energy adoption,Transparent and compliance-driven,$2–3B (India operations estimated),NA,Softwarelicenses 40%;Cloudsubscriptions 40%;Services&support 20%,NA,12%,Profitable,Oracle Corporation; Institutional shareholders (global parent),Parent-funded subsidiary operations,Parent-funded,$80K per enterprise ,$3M+,145.90%,<3%,60,"Not Applicable,cash-flow positive",NA,<1.0,"Hybrid, 50% flexible",Flexible,Occasional during project peaks,Rare,Remote; Hybrid,Central business districts,Metro; Bus; Train,Ride-hailing; Company transport,45 minutes,IT hub,Secure; Well-lit,Late-night transport; Workplace safety,Fire compliant; Secure access,Medical support; Fire drills,"Safra A. Catz (Global CEO, Oracle Corporation)",https://www.linkedin.com/in/safra-catz,"Shailender Kumar, Senior VP and Regional MD",Global Oracle alumni network; Enterprise CIO councils; Technology partner ecosystems,"Low,Large enterprise structure with formal procurement and partner-led access",Shailender Kumar,Senior VP and Regional MD,catherine.blackmore@oracle.com,(737) 867-1000,Oracle Corp appointed directors; Independent compliance officers; Regional leadership,"$1,500 per employee/year",Strong,Internal LMS; Certifications; Cloud bootcamps,High,Leadership mentors; Peer mentors,Medium,Merit-based; Transparent,Enterprise software; Cloud platforms; DevOps tools,High,Medium,Client-facing; Revenue-linked,Balanced,High,Sales; Engineering; Consulting,Mature enterprise,Global top-tier enterprise brand,Fortune 500; Government agencies,Big Tech; Global consultancies; Cloud startups,Very High,Strong enterprise and cloud credibility,Global alumni network; Enterprise CIO network,Global clients; International teams,NVIDIA; Intel; VMware; Red Hat; Infosys; Wipro,Oracle Database IP; Autonomous Database; Cloud security patents,15% of parent revenue allocated globally,"High,autonomous database optimization, cloud AI services, enterprise analytics",Oracle Cloud Infrastructure; Java; Kubernetes; Linux; Python; Terraform,ISO 27001; SOC 2; Global security operations centers,NVIDIA; Infosys; Wipro; VMware; Red Hat,"High,Enterprise Leader; Top-tier cloud maturity"
