54,Groww Invest Tech Pvt. Ltd.,Groww,https://groww.in/static/images/header-logo.svg,FinTech / WealthTech,2016,"Groww is an Indian fintech investment platform enabling retail investors to invest in mutual funds, stocks, ETFs, IPOs, and digital gold through a mobile-first, zero-commission interface.",Private Company,"Bangalore, Karnataka, India",India,2,"Bangalore,India; Gurgaon,India",1200,To become the most trusted financial partner for all Indian households,"To make investing simple, transparent, and accessible to everyone in India",Customer-first; Transparency; Speed; Ownership,Enabled 10M+ first-time investors,Series E funding; AMC acquisition,https://groww.in,https://www.linkedin.com/company/groww-india,https://twitter.com/_groww,https://www.facebook.com/growwindia,https://www.instagram.com/groww_official,support@groww.in,+91 91088 00604,SEBI compliant,None significant,Paperless operations; Financial literacy,Low,Low,Market downturn; Regulation,Low,Transparent pricing,"YouTube,Groww",High App Store ratings,High,4.6 / 5,Top 50 finance sites in India,5M,4.1 / 5,4.0 / 5 ,4.5 / 5,LinkedIn Top Startups India,Very Positive,Startup & FinTech conferences,Complex investing processes; High brokerage fees; Poor UX,FinTech; WealthTech; Online Brokerage,Mutual Funds; Equity Trading; ETFs; IPOs; Digital Gold,Retail investors; Millennials; Gen-Z,"Simple, paperless, zero-commission investing",Zero MF commission; Educational-first UX; Clean UI,Strong brand; Fast onboarding; Scalable tech,Limited advisory services,Market volatility; Regulatory changes,Zerodha; Upstox; Angel One; INDmoney,20% retail online brokerage,Product-led growth,Low,IPO ,Strong UX vs Zerodha,IPO by 2026,Credit; Insurance; Scale,NSE; BSE; AMFI,First-time investor adoption,Content and referral driven,AI insights; New asset classes,Insurance; Loans,$2 Trillion,$150 Billion,$20 Billion,Flexible,Group health insurance,Fixed-heavy,Moderate,Available,Included,Case-based,Moderate,High ,15%,3 years,Improving gender diversity,Fast-paced,High,Moderate–High,Open,Active initiatives,High,Medium,Minimal,Very clear,Financial literacy programs,Proactive,$150M ,Loss-making,Brokerage;Referrals;Interestincome,$3 Billion,200%,Pre-profit,Peak XV; Tiger Global; Ribbit; ICONIQ,"Series E,$251M ",$393M,$8–12,200,5.30%,15%,70,$5M/month,36 months,Moderate,Mostly office-based with flexibility,"9:30 AM,6:30 PM",Occasional,Rare,Hybrid,Central,Good,Available,1 hour,Tech park,High,Strong,High,Standard,Lalit Keshre,https://www.linkedin.com/in/lalitkeshre,Harsh Jain Neeraj Singh,Investors; LinkedIn; Startup ecosystem,Medium,Lalit Keshre,CEO,NA,NA,Founders + Investor nominees,Moderate,Good,Strong,High,Moderate,Available,Medium,Excellent,High,Strong,High,Execution-heavy,High,High,Late-stage startup,Very strong,Retail-focused,Strong,High,High,Strong,Limited,AWS; NSE; BSE; CDSL; BillDesk,Trademarks; Proprietary tech,25% of budget,High,Go; Java; React Native; AWS,Strong,Banks; Exchanges; Payment gateways,High
55,MintAir Corp,MintAir,https://in.images.search.yahoo.com/search/images;_ylt=Awr1VTpvlnhp2AIAO6C7HAx.;_ylu=Y29sbwNzZzMEcG9zAzEEdnRpZAMEc2VjA3Nj?type=E211IN1274G0&p=mintair+corp+comapny+logo+link&fr=mcafee&th=248&tw=474&imgurl=https%3A%2F%2Flinktr.ee%2Fog%2Fimage%2Fmintair.jpg&rurl=https%3A%2F%2Flinktr.ee%2Fmintair&size=21KB&name=Mintair+%7C+Twitter+%7C+Linktree&oid=1&h=630&w=1200&turl=https%3A%2F%2Ftse1.mm.bing.net%2Fth%2Fid%2FOIP.l_xhBuyjaQwLKb3ewxiRZgHaD4%3Fpid%3DApi&tt=Mintair+%7C+Twitter+%7C+Linktree&sigr=jXdts_GYhzjx&sigit=7gDU3rFi4.kd&sigi=JUYPrCegeSGU&sign=ztZIbEsZYiqh&sigt=ztZIbEsZYiqh,Aviation & Air Mobility Services,2018,"MintAir Corp is a boutique private aviation company delivering charter flight services, aircraft management, and premium air mobility solutions",Privately Held Company,United States,United States,2,"Seattle,United States; Minneapolis,United States; Detroit,United States; Phoenix,United States; Charlotte,United States; Raleigh,United States; Austin,United States; San Jose,United States; Hillsboro,United States; Plano,United States",120,To make premium air mobility efficient and dependable,"Deliver safe, customer-focused aviation services with operational excellence","Safety, Trust, Reliability, Customer Commitment",Operates lean aviation teams with high service customization,Internal expansion of charter operations,NA,Company-listed LinkedIn business page,NA,NA,NA,operations@mintaircorp.com,NA,FAA-compliant aviation operator,No known legal issues,Basic ESG compliance,Aircraft leasing and MRO providers,Low,"Fuel costs, travel demand fluctuations",Moderate aviation emissions,Compliance-based sourcing,Short corporate overview videos,High satisfaction repeat customers,Functional and informational,6.5 / 10,Low-volume niche traffic,2000,4.0 / 5 ,4.1 / 5 ,4.3 / 5,Regional aviation service recognition,Positive,Regional aviation & charter expos,"Time-efficient travel, schedule flexibility, premium aviation access","Aviation, Travel, Business Mobility","Private jet charter, aircraft leasing support, aviation operations","High-net-worth individuals, executives, SMEs","Reliable, flexible, and personalized private air travel",Boutique service model with high personalization,Operational flexibility and customer-centric execution,Limited international reach,Fleet scaling and brand awareness,"NetJets, Wheels Up, VistaJet",1%,Relationship-led sales,Medium,Long-term private growth,Smaller but agile operator,Fleet expansion and regional growth,"Safety, reliability, controlled scaling",Regional aviation associations,Executive charter success stories,Direct sales and referral-based growth,Efficiency improvements and service digitization,Expanded charter packages,$100B,$5B,$40M,Standard industry leave,Health insurance provided,Mixed,Moderate,Limited,Yes,Case-by-case,Basic,Low to Moderate,8%,4 years,Mixed-gender and multicultural workforce,"Close-knit, execution-focused",Strong ,Moderate,Direct and informal,Developing,High,Moderate,None,Clear,Early-stage initiatives,"Safety-first, conservative",$28 million,$4.5 million,"Charterservices(70%),aircraftmanagement(30%)",$65 million,14%,Profitable,Founder-funded and private investors,Seed-stage private funding,$12 million,High,Very High,Strong,Low (6%),68,Low,24 months,<1,Role-based,8–10 hours,Moderate,Occasional,Mostly on-site,Airport-peripheral,Limited,On-demand reimbursements,Immediate,Aviation operations zone,High,Strict aviation safety protocols,High,Strong,Founder & Managing Director,NA,"Head of Operations, Chief Pilot, Finance Lead","Referrals, aviation brokers, direct outreach",High,Operations Manager,Head of Operations,ops@mintaircorp.com,NA,Founder-led advisory board,Moderate,Structured,Practical and hands-on,High operational exposure,Limited but direct,Moderate,Performance-based,Adequate,Clear,High,High,Execution-heavy,Low to Medium,High,Early-growth,Emerging,Premium,Aviation leadership roles,High ,Regional,Moderate,Low,Aviation scheduling and flight-ops software providers,Operational trademarks,Minimal,Low,"FlightOps software, scheduling tools",Standard commercial protections,Aviation maintenance and charter partners,Medium
56,"OpenAI, Inc.",OpenAI,https://upload.wikimedia.org/wikipedia/commons/3/3c/OpenAI_Logo.svg; https://cdn.openai.com/openai-logo.svg,Scale-up,2015,"OpenAI is an artificial intelligence research and deployment company focused on ensuring that artificial general intelligence benefits all of humanity, building and scaling models such as ChatGPT, GPT series, and Sora for global users.",Public Benefit Corporation ,"1455 Third Street, San Francisco, CA 94158, USA",United States; Canada; United Kingdom; France; Japan; Hong Kong; Ireland; Belgium; Brazil; Australia,8,"New York,United States; Paris,France; Brussels,Belgium; London,United Kingdom; Dublin,Ireland; Tokyo,Japan",6400,Ensure artificial general intelligence benefits all of humanity,To build safe and broadly beneficial artificial intelligence,Humanity first; integrity; transparency; collaboration; safety-first innovation,Founded as a non-profit; ChatGPT became the fastest-growing consumer app,GPT-5.2 launch; Sora 2 release; large-scale infrastructure funding,https://openai.com,https://www.linkedin.com/company/openai,@OpenAI,https://www.facebook.com/OpenAI,https://www.instagram.com/openai,support@openai.com,(415) 612-5583,SOC 2 Type II; GDPR; CCPA; AI safety governance,Copyright litigation; regulatory investigations,Carbon-neutral compute; ethical AI initiatives,Microsoft Azure; Nvidia GPUs,Export controls; AI regulation divergence,Rising compute costs; regulatory pressure,Carbon-neutral cloud infrastructure,Responsible AI and compliant supplier sourcing,OpenAI DevDay and product launch videos,Strong enterprise and developer advocacy,High-quality modern UX with clear product and research communication,NA,Global top 50; US top 20,50M,4.2/5,4-May,4.5/5,Time 100 recognition; multiple AI innovation awards,Mostly positive with strong industry leadership perception,OpenAI DevDay; global AI safety forums,Accessibility to advanced AI; productivity enhancement; content generation efficiency; data analysis complexity; automation of customer support,Artificial Intelligence; Information Technology; Professional Services; Finance; Healthcare; Education; Government; Media,ChatGPT; GPT-5; Sora 2; OpenAI API; Custom GPTs; DALL·E 3; Codex; Whisper; Realtime API,Microsoft; enterprises; developers; financial institutions; healthcare organizations; government agencies,Frontier AI models delivered via scalable APIs and consumer products with strong safety alignment,GPT leadership; rapid model iteration; Microsoft partnership; massive global adoption,Leading AI models; compute access; strong ecosystem; large developer and user base,High compute costs; regulatory scrutiny; dependence on strategic partners,Scaling compute efficiently; managing AI safety risks; regulatory compliance,Anthropic; Google DeepMind; xAI; Meta AI; Amazon Q; IBM Watson; Cohere; Mistral AI,70% of LLM API market ,Product-led growth with enterprise sales overlay,Medium ,Potential IPO post-profitability,Market leader in AI capability and adoption,Progress toward AGI; expansion across industries,Model leadership; safety; infrastructure efficiency,AI safety and technology policy forums,ChatGPT adoption; enterprise AI deployments,Product-led growth combined with enterprise partnerships,GPT-5; agents; multimodal AI expansion,GPT-5; agentic AI; robotics integration,$1.8T ,Enterprise AI software and APIs,LLM API and consumer AI leadership,Standard corporate leave with flexibility,Comprehensive health benefits,Competitive fixed with equity,Moderate,Equity-based incentives,Included,Provided for key roles,Moderate,High,10%,2 years,Active D&I programs with diverse leadership,Research-driven and mission-focused,Strong technical and mission leadership,Moderate,Direct and research-oriented,Active programs and inclusive leadership,Strong AI safety governance,Moderate to high,Limited and selective,Extremely clear,Responsible AI focus,Resilient and adaptive,$20B ,Negative due to high R&D and compute spend,Subscriptions;APIusage;enterpriselicensing,$157B,Triple-digit ,Not yet profitable,Microsoft; Thrive Capital; Khosla Ventures; Sequoia; a16z; Nvidia,$6.6B round plus 2025–26 investments,$21.3B,High ,Very high ,Strong and favorable,Low,High ,$5B+ annually,Multiple years,High but improving with revenue scale,Primarily in-person with flexibility,"Long, research-intensive",High during major launches,Occasional during releases,Primarily on-site with limited flexibility,Central urban headquarters,Good ,Reimbursed for work needs,30 minutes ,Urban commercial,Moderate to good,Strict workplace and data safety policies,High,Established procedures,Sam Altman,NA,Mira Murati; Greg Brockman; Sarah Friar; Jakub Pachocki,Microsoft network; Y Combinator alumni; Stanford AI ecosystem,Medium ,Enterprise account leadership team,Enterprise Account Director,enterprise@openai.com,NA,Bret Taylor; Larry Summers; Adam D’Angelo; Nicole Seligman; Fidji Simo,High ,Structured onboarding and research mentorship,Continuous learning and experimentation,Very high impact exposure,Strong peer and senior mentorship,Moderate across teams,Performance and impact based,Best-in-class AI and compute tools,High,High,Global-scale impact,Balanced research and execution,Very high,High,Late-stage scale-up,Extremely strong,Top-tier global enterprises,Excellent across tech and research,Extremely high,Global,Very strong industry network,Very high,Microsoft; Nvidia; Oracle; AMD; Broadcom,Proprietary model weights; patents; trademarks,Heavy and continuous across model scaling and safety,Frontier ,PyTorch; Kubernetes; Azure AI; Nvidia H100/B200,High ,Microsoft; Apple; Oracle; PwC; Bain,Extremely high
57,Skyhigh Security,Skyhigh,https://www.skyhighsecurity.com/wp-content/themes/skyhighsecurity/assets/images/logo-skyhigh-security.svg,Cloud Security / Cybersecurity Software,2011,"Skyhigh Security is a cloud-first data protection company delivering data-aware security across web, cloud, private apps, email, and endpoints.",Privately Held,"Santa Clara, California, USA",United States;India; Australia; Hong Kong; Brazil; Colombia; United Kingdom; Germany;Japan; Canada,9,"Santa Clara,Cuba; Reston,United States; Hillsboro,United States; Plano,United States; Bangalore,India; Hyderabad,India; Bogota,Colombia; Sao Paulo,Brazil; Sydney,Australia; Tokyo,Japan",700,Security as a powerful accelerator for digital transformation,To make data protection easy with visibility and control everywhere,"Innovation, Integrity, Customer Success, Collaboration",Inventor of CASB technology; McAfee spinout,New AI-driven data visibility and DSPM integrations,https://www.skyhighsecurity.com,https://www.linkedin.com/company/skyhigh-security,https://twitter.com/SkyhighSecurity,https://www.facebook.com/SkyhighSecurity,NA,media@skyhighsecurity.com,NA,"FedRAMP High, SOC 2 Type II, ISO 27001, GDPR",No major public controversies,Strong governance and compliance focus,Cloud infrastructure providers,Low–Moderate,Cybersecurity spend cycles,Low physical footprint,Compliance-based sourcing,Available on YouTube,Strong enterprise customer loyalty,"Professional, enterprise-focused",4.6/5,NA,37000,4.1 / 5,4.0 / 5,4.6 / 5,"SC Awards, Cyber Defense InfoSec Awards",Positive,"RSA Conference, Black Hat, Gartner Events","Cloud data protection, threat detection, regulatory compliance, secure remote work, AI data risks","IT, Financial Services, Government, Healthcare, Manufacturing, Retail","SSE, CASB, SWG, ZTNA, CNAPP, DLP, RBI, Cloud Firewall, Skyhigh AI","Fortune 500 enterprises, global banks, government agencies","Cloud-native, data-aware security with unified visibility and control","Data-aware SSE platform, AI-powered security, strong compliance posture","Unified DLP, large enterprise adoption, certifications, AI innovation","Limited financial transparency, integration complexity","AI threat evolution, global compliance, talent retention","Zscaler, Netskope, Palo Alto Networks, Cisco, Microsoft",NA,Enterprise direct sales,Medium,"McAfee spinout, PE ownership",Competitive with Zscaler and Netskope,Continued growth in SSE and AI security,"AI security, cloud data protection, compliance",Cloud Security Alliance,Global banks and retailers,Enterprise-focused direct sales,AI-powered data visibility and DSPM,Enhanced SSE and AI security modules,50B,20B,2–3B,Competitive,Comprehensive insurance,Balanced,Moderate,Limited,Yes,Yes,Good,Moderate ,NA,NA,Active D&I programs,"Innovation-driven, enterprise-focused",Strong,Moderate–High,Open,Strong,High,Moderate,No major recent layoffs,Clear,Governance-focused CSR,Stable and security-first,400–600M,EBITDA positive ,Subscription-basedSaaS,NA,12–15%,Profitable,Symphony Technology Group ,PE acquisition,200M,High,Very High,Strong,Low,65–70,Low,Stable,<1,Hybrid,40–45 hours/week,Low,Rare,Hybrid,Suburban tech hub,Moderate,Available,20–30 minutes,Corporate tech campus,High,Strong,High,Robust,Vishal Rao,https://www.linkedin.com/in/vishalrao1,"Sanjay Castelino, James Denena, Ken Schock, Thyaga Vasudevan","STG network, McAfee alumni, RSA Conference",Medium,Sanjay Castelino,President,press@skyhighsecurity.com,NA,STG-appointed board,High,Structured,Strong,High,Available,High,Moderate,Excellent,Clear,Moderate,High,Balanced,High,High,Growth-stage,High,Enterprise-grade,Strong in cybersecurity industry,Very High,Global cybersecurity recognition,Strong enterprise network,High,"AWS, Microsoft Azure, Google Cloud, Okta, CrowdStrike",Security and data protection patents,High,High,"Cloud-native microservices, AI/ML, APIs",Enterprise-grade,Strong global cloud and security partners,Very High
58,Space Exploration Technologies Corp.,SpaceX,https://upload.wikimedia.org/wikipedia/commons/d/de/SpaceX-Logo.svg,Private Aerospace Manufacturer; Space Transportation; Satellite Communications,2002,SpaceX is a private aerospace manufacturer and space transportation company focused on reducing spaceflight costs and enabling multi-planetary human life through reusable launch systems and satellite networks.,Private,"Hawthorne, California, United States",United States; United Kingdom; Germany; Japan; India; Australia; Brazil; Canada; France; Mexico,10,"Hawthorne,United States; Boca Chica,Dominican Republic; Cape Canaveral,United States; Seattle,United States; Austin,United States",13000,Enable multi-planetary human life,Reduce spaceflight costs and expand access to space,High intensity; Mission-driven; Engineering-first; Scrappy,First company to reuse orbital-class rockets at scale,Starship tests; Starlink expansion; NASA contracts,https://www.spacex.com,https://www.linkedin.com/company/spacex,@SpaceX,NA,NA ,NA,NA,FAA; FCC; ITAR compliant,Environmental lawsuits ; labor disputes,Reusability-driven sustainability,Specialized aerospace materials,Anti-satellite conflict exposure,Capital intensity; regulatory risk,Methane fuel; reusability reduces emissions,ITAR-compliant aerospace sourcing,SpaceX launch videos ,High satisfaction among Starlink users,Technical; futuristic; launch-centric,NA,NA,Very high; millions across platforms,3.8 / 5,4-May,4.2/5,NASA and aerospace innovation awards,Generally positive for innovation; mixed leadership sentiment,Starship launches; aerospace conferences,High launch costs; limited access to space; lack of global broadband,Aerospace; Space Transportation; Satellite Internet; Defense,Falcon 9; Falcon Heavy; Starship; Dragon Spacecraft; Starlink,NASA; US Space Force; Commercial satellite operators; Global consumers ,Rapid reusability and lowest cost-per-kg to orbit,Full vertical integration; reusable rockets; rapid hardware iteration,Cost leadership; high launch cadence; Starlink ecosystem,Founder dependency; regulatory exposure; employee burnout,Regulatory delays; environmental scrutiny; Starship scalability,Blue Origin; United Launch Alliance; Arianespace; Northrop Grumman,60%+ commercial launch market,Direct enterprise and government sales,Medium ,No SpaceX IPO; Starlink IPO possible,Industry leader in cost and cadence,Mars missions; Starlink global scale,Reusability; Starship; interplanetary transport,Aerospace and defense industry bodies,Falcon 9 reuse; ISS resupply missions,Government and commercial contracts,Fully reusable Starship; Mars,Starship; Starlink V3,$500B,Commercial launch and broadband,Dominant share in commercial launch,Standard,On-site medical facilities,Competitive base ,Low,Equity-based,Provided,Provided for key roles,Limited,Aerospace engineers; Manufacturing technicians; Software engineers; Operations roles,15%,2–4 years,STEM outreach; improving representation,High-intensity; mission-driven,Execution-focused leadership,Moderate,Direct; performance-driven,Improving,Aerospace safety-first,High,Minimal,Extremely clear,Reusability-focused,Decisive and fast-moving,$9 billion ,Positive cash flow in select periods,Launchservices;Starlinksubscriptions,$180 billion,NA,Profitable in select quarters,Fidelity; Google ; Founders Fund; Baillie Gifford,Ongoing private funding,$10 billion,Decreasing,High ,Favorable,Low,High customer satisfaction ,Moderate,Strong due to recurring revenue streams,Efficient relative to capital intensity,Mostly on-site,Long; demanding,High,Common during launches,Mostly on-site,Mixed,Limited,Limited,NA,Industrial / aerospace,Moderate,Strict launch and facility safety,High,High,Elon Musk,NA,Gwynne Shotwell; Bret Johnsen; Bill Gerstenmaier,Investor network; government partnerships; industry forums,Low,NA,NA,NA,NA,Elon Musk; Kimbal Musk; Luke Nosek; Steve Jurvetson,Strong ,Strong technical onboarding,High,Very high,Moderate,Limited,Performance-based,Cutting-edge,High,Very high,Extremely high,Execution-heavy,High,High,Mature growth,Iconic,Top-tier government and enterprise,High,Extremely high,Global,Strong government and aerospace,Very high,NASA; US Department of Defense; ESA,Trade-secret heavy; proprietary systems,Heavy and continuous,High ,C++; Python; MATLAB; LabVIEW; NX CAD,High ,NASA; DoD; ESA; commercial operators,Extremely high
59,Walmart Inc.,Walmart,https://corporate.walmart.com/images/default-source/default-album/walmart-logo.png,Multinational Retail Corporation,1962,"Walmart is the world’s largest omnichannel retailer operating hypermarkets, discount stores, grocery stores, wholesale clubs, and eCommerce platforms globally.",Public Company,"Bentonville, Arkansas, United States",United States; Mexico; Canada; United Kingdom; China; India; Chile; South Africa; Japan; Brazil,100+,"Bentonville,United States; Mexico City, Mexico; Mississauga,Canada; London,United Kingdom; Beijing, China; Bangalore, India; Johannesburg,South Africa",2100000,To help people save money and live better,We save people money so they can live better,"Service, Respect, Integrity, Excellence",World’s largest private employer,"Expansion of automation, Vizio acquisition, Walmart+ growth",https://www.walmart.com,https://www.linkedin.com/company/walmart,https://twitter.com/Walmart,https://www.facebook.com/walmart,https://www.instagram.com/walmart,help@walmart.com,NA,Fully compliant,Labor and opioid-related settlements,Strong sustainability initiatives,Global suppliers and logistics partners,"Trade policies, tariffs","Inflation, consumer spending cycles",Project Gigaton initiatives,Supplier standards enforced,Available on YouTube,High value loyalty,High-quality omnichannel retail experience,4.6/5,Top 20 globally,60M,3.3 / 5,3.4 / 5,4.2 / 5,"Fortune 500 1, Most Admired Companies",Positive,"CES, NRF Retail’s Big Show","Affordable pricing, cost of living pressure, food access, convenience","Retail, Grocery, eCommerce, Logistics, FinTech, Healthcare","Retail stores, eCommerce, Walmart+, Sam’s Club, Pharmacy","Mass-market consumers, families, SMB sellers",Everyday low prices with unmatched scale and convenience,"Massive scale, EDLP pricing, omnichannel reach","Supply-chain dominance, data scale, store footprint","Thin margins, labor-intensive operations","E-commerce profitability, labor retention, theft","Amazon, Target, Costco, Kroger",15% US grocery,High-volume B2C retail,Low,Long-term public company,Market leader,Continued omnichannel expansion,"Automation, eCommerce, advertising","NRF, World Economic Forum","Flipkart growth, automation rollout",Omnichannel mass retail,"AI-driven fulfillment, automation","Private labels, digital services",$25 Trillion,$5 Trillion,$600 Billion,Standard corporate & retail,Comprehensive health plans,Mostly fixed,Moderate,Limited,Yes,Yes,Moderate,High ,50–60% ,3.3 years,Strong diversity programs,"Fast-paced, operational",Mixed,Moderate,Structured,Strong,High,High ,Periodic restructuring,Very clear,Strong focus,Stable and resilient,$611 Billion,$15 Billion,"Retailsales,memberships,advertising",$450 Billion,7%,Profitable,"Walton Family, Vanguard, BlackRock",IPO ,NA,$10–15,15000,Very favorable,Low,35–40,NA,Stable,NA,Mostly on-site with limited hybrid,Shift-based / 40+,Moderate,Common for retail roles,Mostly on-site,Mix of both,Varies by location,Limited,30–60 minutes,Corporate campus & retail zones,High,Strong,High,Robust,Doug McMillon,https://www.linkedin.com/in/dougmcmillon,"John David Rainey, John Furner, Kath McLay","Vendor partnerships, industry events",Medium,Doug McMillon,President & CEO,executive.office@walmart.com,NA,Walton family-influenced board,High,Structured,Moderate,High,Available,High,Moderate,Excellent,Clear,Moderate,High,Execution-heavy,High,High,Very mature,Extremely high,Mass-market,Strong retail & ops exits,High,Global,Very strong,Very high,"Microsoft, Google Cloud, Shopify, FedEx",Logistics and automation patents,$2B annually,High,"Cloud, AI, data platforms, automation",Enterprise-grade,Large global partner network,Very High
